[
  {
    "chain": "ethereum",
    "chainId": 1,
    "address": "0x01B19c68f8A9eE3a480dA788ba401cFAbdf19B93",
    "assetNamespace": "erc20",
    "assetReference": "0x01B19c68f8A9eE3a480dA788ba401cFAbdf19B93",
    "deploymentType": "issuer-native",
    "standardIds": [
      "erc20"
    ],
    "standardEvidence": [
      {
        "standardId": "erc20",
        "method": "issuer-documentation",
        "sourceId": "ondo-token-list"
      }
    ],
    "decimals": 18,
    "status": "active",
    "verifiedBy": [
      "ondo-token-list",
      "ethereum-explorer"
    ],
    "verification": {
      "lastVerifiedAt": "2026-10-02T08:49:21.485Z",
      "accountExists": true,
      "method": "evm-bytecode",
      "runtimeCodeSha256": "6060dd38da4f6b8a88c46c019ee34a863b3db7b0df25ecdf7af71d0339fdb314",
      "explorerVerified": "unknown",
      "observedName": "Linde plc (Ondo Tokenized)",
      "observedSymbol": "LINon",
      "observedDecimals": 18,
      "dataAvailability": {
        "deploymentTransaction": "unknown",
        "deploymentBlock": "unknown",
        "proxyImplementation": "not-applicable",
        "contractAdmin": "not-applicable",
        "explorerVerification": "unknown",
        "observedName": "known",
        "observedSymbol": "known",
        "observedDecimals": "known"
      }
    }
  },
  {
    "chain": "bnb-chain",
    "chainId": 56,
    "address": "0xE1743616f705954620aa351465c8885fBDE5A8A9",
    "assetNamespace": "erc20",
    "assetReference": "0xE1743616f705954620aa351465c8885fBDE5A8A9",
    "deploymentType": "issuer-native",
    "standardIds": [
      "erc20"
    ],
    "standardEvidence": [
      {
        "standardId": "erc20",
        "method": "issuer-documentation",
        "sourceId": "ondo-token-list"
      }
    ],
    "decimals": 18,
    "status": "active",
    "verifiedBy": [
      "ondo-token-list",
      "bnb-chain-explorer"
    ],
    "verification": {
      "lastVerifiedAt": "2026-10-02T08:49:21.485Z",
      "accountExists": true,
      "method": "evm-bytecode",
      "runtimeCodeSha256": "e696145eb05732cec127a85c3b0a3ac5db14f4f565d8099ee4645b2d60a238fa",
      "explorerVerified": "unknown",
      "observedName": "Linde plc (Ondo Tokenized)",
      "observedSymbol": "LINon",
      "observedDecimals": 18,
      "dataAvailability": {
        "deploymentTransaction": "unknown",
        "deploymentBlock": "unknown",
        "proxyImplementation": "not-applicable",
        "contractAdmin": "not-applicable",
        "explorerVerification": "unknown",
        "observedName": "known",
        "observedSymbol": "known",
        "observedDecimals": "known"
      }
    }
  },
  {
    "chain": "solana",
    "address": "Edik9MoFp8LAXS9HNu2gRFyihwYqDqv4ZmNmVT9ondo",
    "assetNamespace": "token",
    "assetReference": "Edik9MoFp8LAXS9HNu2gRFyihwYqDqv4ZmNmVT9ondo",
    "deploymentType": "issuer-native",
    "standardIds": [
      "solana-token-2022"
    ],
    "standardEvidence": [
      {
        "standardId": "solana-token-2022",
        "method": "issuer-documentation",
        "sourceId": "ondo-solana-mint-list"
      }
    ],
    "decimals": 9,
    "status": "active",
    "verifiedBy": [
      "ondo-solana-mint-list",
      "solana-explorer"
    ],
    "verification": {
      "lastVerifiedAt": "2026-10-02T08:49:21.485Z",
      "accountExists": true,
      "method": "solana-account-owner",
      "accountDataSha256": "57ea8f9c042ad888f4ac7d7ba77512911f9bc45e1d1f81247453868f608c9b31",
      "owner": "TokenzQdBNbLqP5VEhdkAS6EPFLC1PHnBqCXEpPxuEb",
      "explorerVerified": "unknown",
      "observedDecimals": 9,
      "dataAvailability": {
        "deploymentTransaction": "unknown",
        "deploymentBlock": "unknown",
        "proxyImplementation": "unknown",
        "contractAdmin": "unknown",
        "explorerVerification": "unknown",
        "observedName": "unknown",
        "observedSymbol": "unknown",
        "observedDecimals": "known"
      }
    }
  }
]
