[
  {
    "chain": "ethereum",
    "chainId": 1,
    "address": "0xDEbb8E6F581655759e3D64f769247a007AF0aE36",
    "assetNamespace": "erc20",
    "assetReference": "0xDEbb8E6F581655759e3D64f769247a007AF0aE36",
    "deploymentType": "issuer-native",
    "standardIds": [
      "erc20"
    ],
    "standardEvidence": [
      {
        "standardId": "erc20",
        "method": "issuer-documentation",
        "sourceId": "ondo-token-list"
      }
    ],
    "decimals": 18,
    "status": "active",
    "verifiedBy": [
      "ondo-token-list",
      "ethereum-explorer"
    ],
    "verification": {
      "lastVerifiedAt": "2026-10-02T08:49:21.485Z",
      "accountExists": true,
      "method": "evm-bytecode",
      "runtimeCodeSha256": "6060dd38da4f6b8a88c46c019ee34a863b3db7b0df25ecdf7af71d0339fdb314",
      "explorerVerified": "unknown",
      "observedName": "TTM Technologies (Ondo Tokenized)",
      "observedSymbol": "TTMIon",
      "observedDecimals": 18,
      "dataAvailability": {
        "deploymentTransaction": "unknown",
        "deploymentBlock": "unknown",
        "proxyImplementation": "not-applicable",
        "contractAdmin": "not-applicable",
        "explorerVerification": "unknown",
        "observedName": "known",
        "observedSymbol": "known",
        "observedDecimals": "known"
      }
    }
  },
  {
    "chain": "bnb-chain",
    "chainId": 56,
    "address": "0xF400b05AD5A791c65Acc3f905E5aDe5F1B653c8c",
    "assetNamespace": "erc20",
    "assetReference": "0xF400b05AD5A791c65Acc3f905E5aDe5F1B653c8c",
    "deploymentType": "issuer-native",
    "standardIds": [
      "erc20"
    ],
    "standardEvidence": [
      {
        "standardId": "erc20",
        "method": "issuer-documentation",
        "sourceId": "ondo-token-list"
      }
    ],
    "decimals": 18,
    "status": "active",
    "verifiedBy": [
      "ondo-token-list",
      "bnb-chain-explorer"
    ],
    "verification": {
      "lastVerifiedAt": "2026-10-02T08:49:21.485Z",
      "accountExists": true,
      "method": "evm-bytecode",
      "runtimeCodeSha256": "e696145eb05732cec127a85c3b0a3ac5db14f4f565d8099ee4645b2d60a238fa",
      "explorerVerified": "unknown",
      "observedName": "TTM Technologies (Ondo Tokenized)",
      "observedSymbol": "TTMIon",
      "observedDecimals": 18,
      "dataAvailability": {
        "deploymentTransaction": "unknown",
        "deploymentBlock": "unknown",
        "proxyImplementation": "not-applicable",
        "contractAdmin": "not-applicable",
        "explorerVerification": "unknown",
        "observedName": "known",
        "observedSymbol": "known",
        "observedDecimals": "known"
      }
    }
  },
  {
    "chain": "solana",
    "address": "kWmjV2XdK5tbV6kZrM8grS6EGFmuH5i5HFW3YyLondo",
    "assetNamespace": "token",
    "assetReference": "kWmjV2XdK5tbV6kZrM8grS6EGFmuH5i5HFW3YyLondo",
    "deploymentType": "issuer-native",
    "standardIds": [
      "solana-token-2022"
    ],
    "standardEvidence": [
      {
        "standardId": "solana-token-2022",
        "method": "issuer-documentation",
        "sourceId": "ondo-solana-mint-list"
      }
    ],
    "decimals": 9,
    "status": "active",
    "verifiedBy": [
      "ondo-solana-mint-list",
      "solana-explorer"
    ],
    "verification": {
      "lastVerifiedAt": "2026-10-02T08:49:21.485Z",
      "accountExists": true,
      "method": "solana-account-owner",
      "accountDataSha256": "b5721f09f866a007c0383a3f1c7f83185b1979bae234d8be28baeab11d79054b",
      "owner": "TokenzQdBNbLqP5VEhdkAS6EPFLC1PHnBqCXEpPxuEb",
      "explorerVerified": "unknown",
      "observedDecimals": 9,
      "dataAvailability": {
        "deploymentTransaction": "unknown",
        "deploymentBlock": "unknown",
        "proxyImplementation": "unknown",
        "contractAdmin": "unknown",
        "explorerVerification": "unknown",
        "observedName": "unknown",
        "observedSymbol": "unknown",
        "observedDecimals": "known"
      }
    }
  }
]
