[
  {
    "chain": "ethereum",
    "chainId": 1,
    "address": "0x0CE36D199Bd6851788e03392568849394cBdE722",
    "assetNamespace": "erc20",
    "assetReference": "0x0CE36D199Bd6851788e03392568849394cBdE722",
    "deploymentType": "issuer-native",
    "standardIds": [
      "erc20"
    ],
    "standardEvidence": [
      {
        "standardId": "erc20",
        "method": "issuer-documentation",
        "sourceId": "ondo-token-list"
      }
    ],
    "decimals": 18,
    "status": "active",
    "verifiedBy": [
      "ondo-token-list",
      "ethereum-explorer"
    ],
    "verification": {
      "lastVerifiedAt": "2026-10-02T08:49:21.485Z",
      "accountExists": true,
      "method": "evm-bytecode",
      "runtimeCodeSha256": "6060dd38da4f6b8a88c46c019ee34a863b3db7b0df25ecdf7af71d0339fdb314",
      "explorerVerified": "unknown",
      "observedName": "abrdn Physical Palladium Shares ETF (Ondo Tokenized)",
      "observedSymbol": "PALLon",
      "observedDecimals": 18,
      "dataAvailability": {
        "deploymentTransaction": "unknown",
        "deploymentBlock": "unknown",
        "proxyImplementation": "not-applicable",
        "contractAdmin": "not-applicable",
        "explorerVerification": "unknown",
        "observedName": "known",
        "observedSymbol": "known",
        "observedDecimals": "known"
      }
    }
  },
  {
    "chain": "bnb-chain",
    "chainId": 56,
    "address": "0x3FCd741646a9790635b938Cdb69Af5df356cBaAB",
    "assetNamespace": "erc20",
    "assetReference": "0x3FCd741646a9790635b938Cdb69Af5df356cBaAB",
    "deploymentType": "issuer-native",
    "standardIds": [
      "erc20"
    ],
    "standardEvidence": [
      {
        "standardId": "erc20",
        "method": "issuer-documentation",
        "sourceId": "ondo-token-list"
      }
    ],
    "decimals": 18,
    "status": "active",
    "verifiedBy": [
      "ondo-token-list",
      "bnb-chain-explorer"
    ],
    "verification": {
      "lastVerifiedAt": "2026-10-02T08:49:21.485Z",
      "accountExists": true,
      "method": "evm-bytecode",
      "runtimeCodeSha256": "e696145eb05732cec127a85c3b0a3ac5db14f4f565d8099ee4645b2d60a238fa",
      "explorerVerified": "unknown",
      "observedName": "abrdn Physical Palladium Shares ETF (Ondo Tokenized)",
      "observedSymbol": "PALLon",
      "observedDecimals": 18,
      "dataAvailability": {
        "deploymentTransaction": "unknown",
        "deploymentBlock": "unknown",
        "proxyImplementation": "not-applicable",
        "contractAdmin": "not-applicable",
        "explorerVerification": "unknown",
        "observedName": "known",
        "observedSymbol": "known",
        "observedDecimals": "known"
      }
    }
  },
  {
    "chain": "solana",
    "address": "P7hTXnKk2d2DyqWnefp5BSroE1qjjKpKxg9SxQqondo",
    "assetNamespace": "token",
    "assetReference": "P7hTXnKk2d2DyqWnefp5BSroE1qjjKpKxg9SxQqondo",
    "deploymentType": "issuer-native",
    "standardIds": [
      "solana-token-2022"
    ],
    "standardEvidence": [
      {
        "standardId": "solana-token-2022",
        "method": "issuer-documentation",
        "sourceId": "ondo-solana-mint-list"
      }
    ],
    "decimals": 9,
    "status": "active",
    "verifiedBy": [
      "ondo-solana-mint-list",
      "solana-explorer"
    ],
    "verification": {
      "lastVerifiedAt": "2026-10-02T08:49:21.485Z",
      "accountExists": true,
      "method": "solana-account-owner",
      "accountDataSha256": "b5b40efddee8ca1de5495c8d422de8d16b7d1c679c4ad48e1595bde20b25daa8",
      "owner": "TokenzQdBNbLqP5VEhdkAS6EPFLC1PHnBqCXEpPxuEb",
      "explorerVerified": "unknown",
      "observedDecimals": 9,
      "dataAvailability": {
        "deploymentTransaction": "unknown",
        "deploymentBlock": "unknown",
        "proxyImplementation": "unknown",
        "contractAdmin": "unknown",
        "explorerVerification": "unknown",
        "observedName": "unknown",
        "observedSymbol": "unknown",
        "observedDecimals": "known"
      }
    }
  }
]
