[
  {
    "chain": "ethereum",
    "chainId": 1,
    "address": "0xA2C1c0b4683A871187d4565Eb63abF9aef5947ee",
    "assetNamespace": "erc20",
    "assetReference": "0xA2C1c0b4683A871187d4565Eb63abF9aef5947ee",
    "deploymentType": "issuer-native",
    "standardIds": [
      "erc20"
    ],
    "standardEvidence": [
      {
        "standardId": "erc20",
        "method": "issuer-documentation",
        "sourceId": "ondo-token-list"
      }
    ],
    "decimals": 18,
    "status": "active",
    "verifiedBy": [
      "ondo-token-list",
      "ethereum-explorer"
    ],
    "verification": {
      "lastVerifiedAt": "2026-10-02T08:49:21.485Z",
      "accountExists": true,
      "method": "evm-bytecode",
      "runtimeCodeSha256": "6060dd38da4f6b8a88c46c019ee34a863b3db7b0df25ecdf7af71d0339fdb314",
      "explorerVerified": "unknown",
      "observedName": "Moderna (Ondo Tokenized)",
      "observedSymbol": "MRNAon",
      "observedDecimals": 18,
      "dataAvailability": {
        "deploymentTransaction": "unknown",
        "deploymentBlock": "unknown",
        "proxyImplementation": "not-applicable",
        "contractAdmin": "not-applicable",
        "explorerVerification": "unknown",
        "observedName": "known",
        "observedSymbol": "known",
        "observedDecimals": "known"
      }
    }
  },
  {
    "chain": "bnb-chain",
    "chainId": 56,
    "address": "0x01486675Da0764eE780EA7cB65C33062E9b2d28c",
    "assetNamespace": "erc20",
    "assetReference": "0x01486675Da0764eE780EA7cB65C33062E9b2d28c",
    "deploymentType": "issuer-native",
    "standardIds": [
      "erc20"
    ],
    "standardEvidence": [
      {
        "standardId": "erc20",
        "method": "issuer-documentation",
        "sourceId": "ondo-token-list"
      }
    ],
    "decimals": 18,
    "status": "active",
    "verifiedBy": [
      "ondo-token-list",
      "bnb-chain-explorer"
    ],
    "verification": {
      "lastVerifiedAt": "2026-10-02T08:49:21.485Z",
      "accountExists": true,
      "method": "evm-bytecode",
      "runtimeCodeSha256": "e696145eb05732cec127a85c3b0a3ac5db14f4f565d8099ee4645b2d60a238fa",
      "explorerVerified": "unknown",
      "observedName": "Moderna (Ondo Tokenized)",
      "observedSymbol": "MRNAon",
      "observedDecimals": 18,
      "dataAvailability": {
        "deploymentTransaction": "unknown",
        "deploymentBlock": "unknown",
        "proxyImplementation": "not-applicable",
        "contractAdmin": "not-applicable",
        "explorerVerification": "unknown",
        "observedName": "known",
        "observedSymbol": "known",
        "observedDecimals": "known"
      }
    }
  },
  {
    "chain": "solana",
    "address": "14VP7DvCAdBCc5XGNZkPt6zhtPzJrWWS64Koxtxyondo",
    "assetNamespace": "token",
    "assetReference": "14VP7DvCAdBCc5XGNZkPt6zhtPzJrWWS64Koxtxyondo",
    "deploymentType": "issuer-native",
    "standardIds": [
      "solana-token-2022"
    ],
    "standardEvidence": [
      {
        "standardId": "solana-token-2022",
        "method": "issuer-documentation",
        "sourceId": "ondo-solana-mint-list"
      }
    ],
    "decimals": 9,
    "status": "active",
    "verifiedBy": [
      "ondo-solana-mint-list",
      "solana-explorer"
    ],
    "verification": {
      "lastVerifiedAt": "2026-10-02T08:49:21.485Z",
      "accountExists": true,
      "method": "solana-account-owner",
      "accountDataSha256": "43aba093b4e2b062a910ca2fbdf476d20a96a863af37ad6197bf8613c4b11636",
      "owner": "TokenzQdBNbLqP5VEhdkAS6EPFLC1PHnBqCXEpPxuEb",
      "explorerVerified": "unknown",
      "observedDecimals": 9,
      "dataAvailability": {
        "deploymentTransaction": "unknown",
        "deploymentBlock": "unknown",
        "proxyImplementation": "unknown",
        "contractAdmin": "unknown",
        "explorerVerification": "unknown",
        "observedName": "unknown",
        "observedSymbol": "unknown",
        "observedDecimals": "known"
      }
    }
  }
]
