[
  {
    "chain": "ethereum",
    "chainId": 1,
    "address": "0x2ca12a3F9635fD69C21580def14F25C210cA9612",
    "assetNamespace": "erc20",
    "assetReference": "0x2ca12a3F9635fD69C21580def14F25C210cA9612",
    "deploymentType": "issuer-native",
    "standardIds": [
      "erc20"
    ],
    "standardEvidence": [
      {
        "standardId": "erc20",
        "method": "issuer-documentation",
        "sourceId": "ondo-token-list"
      }
    ],
    "decimals": 18,
    "status": "active",
    "verifiedBy": [
      "ondo-token-list",
      "ethereum-explorer"
    ],
    "verification": {
      "lastVerifiedAt": "2026-10-02T08:49:21.485Z",
      "accountExists": true,
      "method": "evm-bytecode",
      "runtimeCodeSha256": "6060dd38da4f6b8a88c46c019ee34a863b3db7b0df25ecdf7af71d0339fdb314",
      "explorerVerified": "unknown",
      "observedName": "Super Micro Computer (Ondo Tokenized)",
      "observedSymbol": "SMCIon",
      "observedDecimals": 18,
      "dataAvailability": {
        "deploymentTransaction": "unknown",
        "deploymentBlock": "unknown",
        "proxyImplementation": "not-applicable",
        "contractAdmin": "not-applicable",
        "explorerVerification": "unknown",
        "observedName": "known",
        "observedSymbol": "known",
        "observedDecimals": "known"
      }
    }
  },
  {
    "chain": "bnb-chain",
    "chainId": 56,
    "address": "0xC142ba8ccD36d80C3a001342fb83E4C3d218A873",
    "assetNamespace": "erc20",
    "assetReference": "0xC142ba8ccD36d80C3a001342fb83E4C3d218A873",
    "deploymentType": "issuer-native",
    "standardIds": [
      "erc20"
    ],
    "standardEvidence": [
      {
        "standardId": "erc20",
        "method": "issuer-documentation",
        "sourceId": "ondo-token-list"
      }
    ],
    "decimals": 18,
    "status": "active",
    "verifiedBy": [
      "ondo-token-list",
      "bnb-chain-explorer"
    ],
    "verification": {
      "lastVerifiedAt": "2026-10-02T08:49:21.485Z",
      "accountExists": true,
      "method": "evm-bytecode",
      "runtimeCodeSha256": "e696145eb05732cec127a85c3b0a3ac5db14f4f565d8099ee4645b2d60a238fa",
      "explorerVerified": "unknown",
      "observedName": "Super Micro Computer (Ondo Tokenized)",
      "observedSymbol": "SMCIon",
      "observedDecimals": 18,
      "dataAvailability": {
        "deploymentTransaction": "unknown",
        "deploymentBlock": "unknown",
        "proxyImplementation": "not-applicable",
        "contractAdmin": "not-applicable",
        "explorerVerification": "unknown",
        "observedName": "known",
        "observedSymbol": "known",
        "observedDecimals": "known"
      }
    }
  },
  {
    "chain": "solana",
    "address": "jLca79XzcewRuBZyaJxVxuKpUHcEix1X4CP1RP9ondo",
    "assetNamespace": "token",
    "assetReference": "jLca79XzcewRuBZyaJxVxuKpUHcEix1X4CP1RP9ondo",
    "deploymentType": "issuer-native",
    "standardIds": [
      "solana-token-2022"
    ],
    "standardEvidence": [
      {
        "standardId": "solana-token-2022",
        "method": "issuer-documentation",
        "sourceId": "ondo-solana-mint-list"
      }
    ],
    "decimals": 9,
    "status": "active",
    "verifiedBy": [
      "ondo-solana-mint-list",
      "solana-explorer"
    ],
    "verification": {
      "lastVerifiedAt": "2026-10-02T08:49:21.485Z",
      "accountExists": true,
      "method": "solana-account-owner",
      "accountDataSha256": "fc3f3d86f565b59aa0f29f7a1f540cd9977bbd93af838f6c75147eea636dca5d",
      "owner": "TokenzQdBNbLqP5VEhdkAS6EPFLC1PHnBqCXEpPxuEb",
      "explorerVerified": "unknown",
      "observedDecimals": 9,
      "dataAvailability": {
        "deploymentTransaction": "unknown",
        "deploymentBlock": "unknown",
        "proxyImplementation": "unknown",
        "contractAdmin": "unknown",
        "explorerVerification": "unknown",
        "observedName": "unknown",
        "observedSymbol": "unknown",
        "observedDecimals": "known"
      }
    }
  }
]
