[
  {
    "chain": "robinhood-chain",
    "chainId": 4663,
    "address": "0x47F93d52cBeC7C6D2CfC080e154002370a60dAEA",
    "assetNamespace": "erc20",
    "assetReference": "0x47F93d52cBeC7C6D2CfC080e154002370a60dAEA",
    "deploymentType": "issuer-native",
    "standardIds": [
      "erc20",
      "erc8056"
    ],
    "standardEvidence": [
      {
        "standardId": "erc20",
        "method": "issuer-documentation",
        "sourceId": "robinhood-stock-token-docs"
      },
      {
        "standardId": "erc8056",
        "method": "issuer-documentation",
        "sourceId": "robinhood-stock-token-docs"
      }
    ],
    "decimals": 18,
    "status": "active",
    "verifiedBy": [
      "robinhood-assets-api",
      "robinhood-chain-explorer"
    ],
    "verification": {
      "lastVerifiedAt": "2026-10-02T08:49:21.485Z",
      "accountExists": true,
      "method": "evm-bytecode",
      "runtimeCodeSha256": "399ec4bc5b43db03486ceae11f9a6fc5c126427f8f8e10c90fed0c773f4325c6",
      "explorerVerified": "unknown",
      "observedName": "ASML Holding NV • Robinhood Token",
      "observedSymbol": "ASML",
      "observedDecimals": 18,
      "dataAvailability": {
        "deploymentTransaction": "unknown",
        "deploymentBlock": "unknown",
        "proxyImplementation": "not-applicable",
        "contractAdmin": "not-applicable",
        "explorerVerification": "unknown",
        "observedName": "known",
        "observedSymbol": "known",
        "observedDecimals": "known"
      }
    }
  }
]
